{
 "id": "ism-almaf3ol",
 "title": "اسم المفعول",
 "grade": "الصف الثالث الإعدادي",
 "unit": "المشتقات — الدرس الثاني",
 "pattern": {
  "weights": [
   "{م}فع{و}ل"
  ],
  "caption": "الحروف الملوّنة هي الحروف الزايدة… ودي اللي هتكتشفها بنفسك."
 },
 "discover": [
  {
   "stage": "يعني إيه اسم مفعول؟",
   "screens": [
    {
     "type": "info",
     "title": "نبدأ بجملتين",
     "body": "اقرا الجملتين دول وركّز في الكلمة الملوّنة:",
     "example": [
      "المعلمُ [[شارحٌ]] الدرسَ.",
      "الدرسُ [[مشروحٌ]]."
     ]
    },
    {
     "type": "q",
     "prompt": "في الجملة التانية: الدرس هو اللي شرح، ولا هو اللي اتشرح؟",
     "body": null,
     "example": [
      "الدرسُ [[مشروحٌ]]."
     ],
     "options": [
      {
       "t": "هو اللي اتشرح",
       "ok": true,
       "fb": "مظبوط، الشرح وقع على الدرس."
      },
      {
       "t": "هو اللي شرح",
       "ok": false,
       "fb": "الدرس مبيشرحش… المعلم هو اللي شرحه، والدرس اتشرح."
      }
     ],
     "after": "يبقى «مشروح» بتوصف **اللي وقع عليه الفعل**."
    },
    {
     "type": "q",
     "prompt": "«مشروح» جاية من أنهي فعل؟",
     "body": null,
     "example": [
      "الدرسُ [[مشروحٌ]]."
     ],
     "options": [
      {
       "t": "شُرِحَ",
       "ok": true,
       "fb": "صح، من الفعل **المبني للمجهول** شُرِحَ."
      },
      {
       "t": "شَرَحَ",
       "ok": false,
       "fb": "شَرَحَ مبني للمعلوم، وده بيطلع منه «شارِح»."
      },
      {
       "t": "شرّحَ",
       "ok": false,
       "fb": "شرّح فعل تاني، بمعنى قطّع."
      }
     ],
     "after": null
    },
    {
     "type": "q",
     "prompt": "طب الفرق بين «شارِح» و«مشروح» إيه؟",
     "body": null,
     "example": [
      "المعلمُ [[شارحٌ]] الدرسَ.",
      "الدرسُ [[مشروحٌ]]."
     ],
     "options": [
      {
       "t": "شارح عمل الفعل، ومشروح وقع عليه الفعل",
       "ok": true,
       "fb": "بالظبط: الأولى اسم فاعل، والتانية اسم مفعول."
      },
      {
       "t": "الاتنين عملوا الفعل",
       "ok": false,
       "fb": "الدرس معملش حاجة… هو اللي اتشرح."
      },
      {
       "t": "مفيش فرق",
       "ok": false,
       "fb": "فيه فرق في المعنى: واحد عمل الفعل وواحد وقع عليه."
      }
     ],
     "after": null
    },
    {
     "type": "rule",
     "title": "اسم المفعول",
     "lines": [
      "اسمٌ مشتقٌّ من الفعل **المبنيّ للمجهول** للدلالة على **مَن وقع عليه الفعل**.",
      "مشروح ← شُرِحَ ، مكتوب ← كُتِبَ ، مُستخدَم ← اسْتُخْدِمَ."
     ]
    }
   ]
  },
  {
   "stage": "من الفعل الثلاثي الصحيح",
   "screens": [
    {
     "type": "info",
     "title": "لاحظ التغيير",
     "body": "بص على الأفعال دي وأسماء المفعول منها:",
     "example": [
      "كُتِبَ ← {مَ}كت{و}ب",
      "شُرِحَ ← {مَ}شر{و}ح",
      "حُسِبَ ← {مَ}حس{و}ب"
     ]
    },
    {
     "type": "q",
     "prompt": "قارن الفعل باسم المفعول: إيه اللي اتزاد؟",
     "body": null,
     "example": [
      "كُتِبَ ← مكتوب",
      "شُرِحَ ← مشروح",
      "حُسِبَ ← محسوب"
     ],
     "options": [
      {
       "t": "ميم مفتوحة في الأول، وواو قبل الآخر",
       "ok": true,
       "fb": "صح: {مَ}كت{و}ب."
      },
      {
       "t": "ألف بعد الحرف الأول",
       "ok": false,
       "fb": "الألف دي بتاعة اسم الفاعل (كاتب)، مش اسم المفعول."
      },
      {
       "t": "ميم مضمومة في الأول بس",
       "ok": false,
       "fb": "الميم هنا مفتوحة، وكمان فيه واو قبل الآخر."
      }
     ],
     "after": null
    },
    {
     "type": "q",
     "prompt": "الكلمات دي كلها على وزن واحد. إيه هو؟",
     "body": null,
     "example": [
      "مكتوب ، مشروح ، محسوب ، مفهوم"
     ],
     "options": [
      {
       "t": "مَفْعُول",
       "ok": true,
       "fb": "هو ده الوزن."
      },
      {
       "t": "فاعِل",
       "ok": false,
       "fb": "فاعِل وزن اسم الفاعل من الثلاثي."
      },
      {
       "t": "مُفْعَل",
       "ok": false,
       "fb": "ده شكل اسم المفعول من غير الثلاثي، زي مُكرَم."
      }
     ],
     "after": null
    },
    {
     "type": "q",
     "prompt": "يلا جرّب: اسم المفعول من «فُهِمَ»؟",
     "body": null,
     "example": null,
     "options": [
      {
       "t": "مَفهوم",
       "ok": true,
       "fb": "برافو: على وزن مفعول."
      },
      {
       "t": "فاهِم",
       "ok": false,
       "fb": "فاهم اسم فاعل: اللي فهم."
      },
      {
       "t": "مُفهَم",
       "ok": false,
       "fb": "الميم المضمومة لغير الثلاثي، و«فهم» ثلاثي."
      }
     ],
     "after": null
    },
    {
     "type": "q",
     "prompt": "وفعل أوله واو زي «وُجِدَ»؟",
     "body": null,
     "example": [
      "المعلمُ ____ في المدرسة. (وُجِدَ)"
     ],
     "options": [
      {
       "t": "مَوجود",
       "ok": true,
       "fb": "صح، عادي جدًا على وزن مفعول."
      },
      {
       "t": "واجِد",
       "ok": false,
       "fb": "واجد اسم فاعل."
      },
      {
       "t": "مُوجَد",
       "ok": false,
       "fb": "الثلاثي مبيبدأش بميم مضمومة."
      }
     ],
     "after": null
    },
    {
     "type": "rule",
     "title": "اسم المفعول من الثلاثي",
     "lines": [
      "يُصاغ اسم المفعول من الفعل الثلاثي على وزن **مَفْعُول**.",
      "حُسِبَ ← محسوب ، فُهِمَ ← مفهوم ، عُرِفَ ← معروف ، وُجِدَ ← موجود."
     ]
    }
   ]
  },
  {
   "stage": "الثلاثي الأجوف (وسطه ألف)",
   "screens": [
    {
     "type": "q",
     "prompt": "هنحط «قالَ» على وزن مفعول بالظبط. هتبقى إيه؟",
     "body": null,
     "example": [
      "قالَ ← على وزن مَفْعُول ← ؟"
     ],
     "options": [
      {
       "t": "مَقْوُوْل",
       "ok": true,
       "fb": "صح، دي الخطوة الأولى: مقوول."
      },
      {
       "t": "مَقال",
       "ok": false,
       "fb": "لأ، احنا محتاجين وزن مفعول الأول."
      },
      {
       "t": "قائِل",
       "ok": false,
       "fb": "قائل اسم فاعل."
      }
     ],
     "after": null
    },
    {
     "type": "q",
     "prompt": "«مَقْوُوْل» فيها واوين ورا بعض. هيحصل إيه؟",
     "body": null,
     "example": [
      "مَقْوُوْل"
     ],
     "options": [
      {
       "t": "تتحذف واو مفعول فتبقى: مَقُول",
       "ok": true,
       "fb": "بالظبط! واو مفعول بتتحذف."
      },
      {
       "t": "تدغم الواوين: مَقُوّل",
       "ok": false,
       "fb": "مفيش إدغام هنا، واو مفعول بتتحذف."
      },
      {
       "t": "تبقى ألف: مَقال",
       "ok": false,
       "fb": "لأ، الواو بتتحذف: مَقُول."
      }
     ],
     "after": null
    },
    {
     "type": "q",
     "prompt": "نفس الطريقة مع «باعَ»: مَبْيُوْع ← ؟",
     "body": null,
     "example": [
      "باعَ ← مَبْيُوْع ← ؟"
     ],
     "options": [
      {
       "t": "مَبِيع",
       "ok": true,
       "fb": "صح: واو مفعول اتحذفت، فبقت مَبِيع."
      },
      {
       "t": "مَبُوع",
       "ok": false,
       "fb": "الياء هي اللي فضلت، والواو هي اللي اتحذفت."
      },
      {
       "t": "مُباع",
       "ok": false,
       "fb": "ده اسم مفعول من غير الثلاثي، زي مُقام."
      }
     ],
     "after": null
    },
    {
     "type": "q",
     "prompt": "الكتاب بيوزن «مَقُول» على مَفُعْل. طب «مَبِيع»؟",
     "body": null,
     "example": [
      "مَقُول = مَفُعْل",
      "مَبِيع = ؟"
     ],
     "options": [
      {
       "t": "مَفِعْل",
       "ok": true,
       "fb": "صح، زي مقول بس بالكسرة."
      },
      {
       "t": "مَفْعُول",
       "ok": false,
       "fb": "واو مفعول اتحذفت، فالوزن اتغير."
      },
      {
       "t": "مَفِيل",
       "ok": false,
       "fb": "الوزن بيبقى بالفاء والعين واللام."
      }
     ],
     "after": null
    },
    {
     "type": "rule",
     "title": "الثلاثي الأجوف",
     "lines": [
      "إذا كان الفعل **أجوف** نصوغه على وزن مفعول، ثم **نحذف واو مفعول**.",
      "قال ← مقوول ← **مَقُول** على وزن (مَفُعْل) ، باع ← مبيوع ← **مَبِيع** على وزن (مَفِعْل)."
     ]
    }
   ]
  },
  {
   "stage": "الثلاثي الناقص (آخره ألف)",
   "screens": [
    {
     "type": "q",
     "prompt": "حط «دعا» على وزن مفعول. هتبقى إيه؟",
     "body": null,
     "example": [
      "دعا ← على وزن مَفْعُول ← ؟"
     ],
     "options": [
      {
       "t": "مَدْعُوْو",
       "ok": true,
       "fb": "صح، دي الخطوة الأولى."
      },
      {
       "t": "مَدْعيّ",
       "ok": false,
       "fb": "آخر «دعا» أصله واو (يدعو)، مش ياء."
      },
      {
       "t": "داعٍ",
       "ok": false,
       "fb": "داعٍ اسم فاعل."
      }
     ],
     "after": null
    },
    {
     "type": "q",
     "prompt": "«مَدْعُوْو» فيها واوين. هيحصل إيه المرة دي؟",
     "body": null,
     "example": [
      "مَدْعُوْو"
     ],
     "options": [
      {
       "t": "تدغم الواوين: مَدْعُوّ",
       "ok": true,
       "fb": "بالظبط، هنا إدغام مش حذف."
      },
      {
       "t": "تتحذف واحدة: مَدْعُو",
       "ok": false,
       "fb": "في الناقص بيحصل إدغام، والحذف للأجوف."
      },
      {
       "t": "تبقى ياء: مَدْعيّ",
       "ok": false,
       "fb": "لأ، الأصل واو فبتدغم في واو: مدعوّ."
      }
     ],
     "after": null
    },
    {
     "type": "q",
     "prompt": "طب «قضى»: مَقْضُوْي فيها واو وبعدها ياء. يحصل إيه؟",
     "body": null,
     "example": [
      "قضى ← مَقْضُوْي ← ؟"
     ],
     "options": [
      {
       "t": "الواو تتقلب ياء وتدغم: مَقْضِيّ",
       "ok": true,
       "fb": "صح! وده اللي في الكتاب: مَقضيّ."
      },
      {
       "t": "الياء تتحذف: مَقْضُو",
       "ok": false,
       "fb": "لأ، الواو هي اللي بتتقلب ياء وتدغم."
      },
      {
       "t": "تفضل زي ما هي: مَقْضُوي",
       "ok": false,
       "fb": "مينفعش تفضل كده، لازم تتقلب وتدغم."
      }
     ],
     "after": null
    },
    {
     "type": "q",
     "prompt": "ازاي أعرف آخر الفعل أصله واو ولا ياء؟",
     "body": null,
     "example": [
      "دعا ← يدعو",
      "قضى ← يقضي"
     ],
     "options": [
      {
       "t": "من المضارع",
       "ok": true,
       "fb": "بالظبط: يدعو ← واو ← مدعوّ ، يقضي ← ياء ← مقضيّ."
      },
      {
       "t": "من شكل الألف في الماضي",
       "ok": false,
       "fb": "مش دايمًا واضحة… المضارع أضمن."
      },
      {
       "t": "من اسم الفاعل",
       "ok": false,
       "fb": "اسم الفاعل الاتنين بالياء (داعٍ، قاضٍ)، فمش هيفرّق."
      }
     ],
     "after": null
    },
    {
     "type": "rule",
     "title": "الثلاثي الناقص",
     "lines": [